{
    "id":  "part.pennant-tellurium",
    "name":  "Tellurium",
    "category":  "item_part",
    "subCategory":  "component",
    "aliases":  [

                ],
    "summary":  "This rare metal is foreign to the Origin System and can only be found in asteroids that have made the long journey from other stars.\n\nLocation: Archwing Missions on Uranus",
    "description":  "This rare metal is foreign to the Origin System and can only be found in asteroids that have made the long journey from other stars.\n\nLocation: Archwing Missions on Uranus",
    "stats":  {

              },
    "mechanics":  {

                  },
    "relationships":  [
                          "weapon.pennant"
                      ],
    "release":  {

                },
    "tags":  [
                 "part",
                 "wfcd-generated"
             ],
    "notes":  [
                  "Generated from WFCD component or relic reward data."
              ],
    "sources":  [
                    {
                        "type":  "wfcd-generated",
                        "value":  "component:weapon.pennant"
                    }
                ]
}
