{
    "id":  "mod.primed-reach",
    "sources":  [
                    {
                        "type":  "static-import",
                        "value":  "imports/static/source-snapshots/wfcd/wfcd-mods.json"
                    }
                ],
    "name":  "Primed Reach",
    "subCategory":  "melee",
    "notes":  [
                  "Normalized from static import source.",
                  "Converted from WFCD Mods.json."
              ],
    "mechanics":  {
                      "topRankStats":  [
                                           "+3 Range"
                                       ],
                      "type":  "Melee Mod",
                      "drops":  [
                                    null
                                ],
                      "isAugment":  null,
                      "levelStats":  [
                                         "+0.3 Range",
                                         "+0.5 Range",
                                         "+0.8 Range",
                                         "+1.1 Range",
                                         "+1.4 Range",
                                         "+1.6 Range",
                                         "+1.9 Range",
                                         "+2.2 Range",
                                         "+2.5 Range",
                                         "+2.7 Range",
                                         "+3 Range"
                                     ],
                      "wiki":  {
                                   "thumbnail":  "https://wiki.warframe.com/images/PrimedReachMod.png?58fbb",
                                   "url":  "https://wiki.warframe.com/w/Primed_Reach",
                                   "imageName":  "primed-reach-d51ce87666.jpg",
                                   "available":  true
                               }
                  },
    "aliases":  [
                    "/Lotus/Upgrades/Mods/Melee/Expert/WeaponMeleeRangeIncModExpert"
                ],
    "tags":  [
                 "mod"
             ],
    "category":  "mod",
    "relationships":  [

                      ],
    "description":  "+3 Range",
    "release":  {
                    "releaseDate":  "2015-02-05",
                    "introduced":  {
                                       "date":  "2015-02-05",
                                       "parent":  "15.13",
                                       "url":  "https://wiki.warframe.com/w/Update_15%23Update_15.13",
                                       "name":  "Update 15.13",
                                       "aliases":  [
                                                       "15.13.0",
                                                       "15.13"
                                                   ]
                                   }
                },
    "summary":  "+3 Range",
    "stats":  {
                  "baseDrain":  4,
                  "tradable":  true,
                  "compatName":  "Melee",
                  "masterable":  false,
                  "polarity":  "madurai",
                  "fusionLimit":  10,
                  "isPrime":  true,
                  "rarity":  "Legendary",
                  "transmutable":  false
              }
}
