{
    "id":  "mod.radon-claws",
    "sources":  [
                    {
                        "type":  "static-import",
                        "value":  "imports/static/source-snapshots/wfcd/wfcd-mods.json"
                    }
                ],
    "name":  "Radon Claws",
    "subCategory":  "claws",
    "notes":  [
                  "Normalized from static import source.",
                  "Converted from WFCD Mods.json."
              ],
    "mechanics":  {
                      "topRankStats":  [
                                           "+60% \u003cDT_RADIATION_COLOR\u003eRadiation",
                                           "+80% Critical Damage"
                                       ],
                      "type":  "Companion Mod",
                      "drops":  [
                                    {
                                        "location":  "Scaldra Flayer",
                                        "type":  "Radon Claws",
                                        "chance":  0.06,
                                        "rarity":  "Rare"
                                    },
                                    {
                                        "location":  "Scaldra Jaeger",
                                        "type":  "Radon Claws",
                                        "chance":  0.1,
                                        "rarity":  "Rare"
                                    }
                                ],
                      "isAugment":  null,
                      "levelStats":  [
                                         "+15% \u003cDT_RADIATION_COLOR\u003eRadiation",
                                         "+20% Critical Damage",
                                         "+30% \u003cDT_RADIATION_COLOR\u003eRadiation",
                                         "+40% Critical Damage",
                                         "+45% \u003cDT_RADIATION_COLOR\u003eRadiation",
                                         "+60% Critical Damage",
                                         "+60% \u003cDT_RADIATION_COLOR\u003eRadiation",
                                         "+80% Critical Damage"
                                     ],
                      "wiki":  {
                                   "thumbnail":  "https://wiki.warframe.com/images/RadonClawsMod.png?e3a10",
                                   "url":  "https://wiki.warframe.com/w/Radon_Claws",
                                   "imageName":  "KubrowRadiationEventMeleeMod.jpg",
                                   "available":  true
                               }
                  },
    "aliases":  [
                    "/Lotus/Upgrades/Mods/Sentinel/Kubrow/DualStat/KubrowRadiationEventMeleeMod"
                ],
    "tags":  [
                 "mod"
             ],
    "category":  "mod",
    "relationships":  [

                      ],
    "description":  "+60% \u003cDT_RADIATION_COLOR\u003eRadiation +80% Critical Damage",
    "release":  {
                    "releaseDate":  "2024-12-13",
                    "introduced":  {
                                       "date":  "2024-12-13",
                                       "parent":  "38.0",
                                       "url":  "https://wiki.warframe.com/w/Update_38%23Update_38.0",
                                       "name":  "Update 38.0",
                                       "aliases":  [
                                                       "38",
                                                       "38.0",
                                                       "Warframe: 1999"
                                                   ]
                                   }
                },
    "summary":  "+60% \u003cDT_RADIATION_COLOR\u003eRadiation +80% Critical Damage",
    "stats":  {
                  "baseDrain":  4,
                  "tradable":  true,
                  "compatName":  "Claws",
                  "masterable":  false,
                  "polarity":  "madurai",
                  "fusionLimit":  3,
                  "isPrime":  false,
                  "rarity":  "Rare",
                  "transmutable":  false
              }
}
