{
    "id":  "activity.neutral-entrati-father",
    "name":  "Entrati (Father), Neutral",
    "category":  "activity",
    "subCategory":  "star-chart-node",
    "aliases":  [

                ],
    "summary":  "Entrati (Father) on Neutral is a generated star-chart activity anchor derived from sourced drop data.",
    "description":  "Generated from WFCD drop-location normalization.",
    "stats":  {

              },
    "mechanics":  {
                      "activityType":  "star-chart-node",
                      "missionType":  "",
                      "sourceAliases":  [
                                            "Entrati (Father), Neutral"
                                        ]
                  },
    "relationships":  [
                          "location.neutral"
                      ],
    "release":  {

                },
    "tags":  [
                 "activity",
                 "star-chart",
                 "generated",
                 "wfcd-derived"
             ],
    "notes":  [
                  "Generated from parseable drop location strings."
              ],
    "sources":  [
                    {
                        "type":  "wfcd-location-normalizer",
                        "value":  "Entrati (Father), Neutral"
                    }
                ]
}
