{
    "id":  "part.dehtat-fersteel-alloy",
    "name":  "Fersteel Alloy",
    "category":  "item_part",
    "subCategory":  "component",
    "aliases":  [

                ],
    "summary":  "Ferros that has been forged into a stronger metal.\n\nBlueprint sold by Old Man Suumbaat in Cetus on Earth.",
    "description":  "Ferros that has been forged into a stronger metal.\n\nBlueprint sold by Old Man Suumbaat in Cetus on Earth.",
    "stats":  {

              },
    "mechanics":  {

                  },
    "relationships":  [
                          "weapon.dehtat"
                      ],
    "release":  {

                },
    "tags":  [
                 "part",
                 "wfcd-generated"
             ],
    "notes":  [
                  "Generated from WFCD component or relic reward data."
              ],
    "sources":  [
                    {
                        "type":  "wfcd-generated",
                        "value":  "component:weapon.dehtat"
                    }
                ]
}
