{
    "id":  "weapon.sweeper",
    "sources":  [
                    {
                        "type":  "static-import",
                        "value":  "imports/static/source-snapshots/wfcd/wfcd-weapons.json"
                    }
                ],
    "name":  "Sweeper",
    "subCategory":  "companion-companion-weapon",
    "notes":  [
                  "Normalized from static import source.",
                  "Converted from WFCD companion static data."
              ],
    "mechanics":  {
                      "drops":  [
                                    null
                                ],
                      "crafting":  {
                                       "buildTime":  null,
                                       "buildPrice":  null,
                                       "buildQuantity":  null,
                                       "components":  [
                                                          {
                                                              "name":  null,
                                                              "uniqueName":  null,
                                                              "itemCount":  null,
                                                              "type":  null,
                                                              "tradable":  null,
                                                              "drops":  [
                                                                            null
                                                                        ]
                                                          }
                                                      ],
                                       "skipBuildTimePrice":  null,
                                       "consumeOnBuild":  null
                                   },
                      "wiki":  {
                                   "thumbnail":  "https://wiki.warframe.com/images/Sweeper.png?dd720",
                                   "url":  "https://wiki.warframe.com/w/Sweeper",
                                   "imageName":  "Sweeper.png",
                                   "available":  true
                               },
                      "attacks":  [
                                      {
                                          "name":  "Normal Attack",
                                          "speed":  1,
                                          "crit_chance":  10,
                                          "crit_mult":  1.8,
                                          "status_chance":  4.5,
                                          "shot_type":  "Hit-Scan",
                                          "falloff":  {
                                                          "start":  200,
                                                          "end":  300,
                                                          "reduction":  0
                                                      },
                                          "damage":  {
                                                         "impact":  29.75,
                                                         "slash":  3.5,
                                                         "puncture":  1.75
                                                     }
                                      }
                                  ],
                      "damageTypes":  null,
                      "slamRadialDamage":  null,
                      "slamRadius":  null,
                      "blockingAngle":  null,
                      "damage":  {
                                     "tau":  0,
                                     "impact":  29.75,
                                     "heat":  0,
                                     "gas":  0,
                                     "corrosive":  0,
                                     "electricity":  0,
                                     "true":  0,
                                     "slash":  3.4999988,
                                     "magnetic":  0,
                                     "cold":  0,
                                     "cinematic":  0,
                                     "viral":  0,
                                     "toxin":  0,
                                     "puncture":  1.75,
                                     "shieldDrain":  0,
                                     "energyDrain":  0,
                                     "radiation":  0,
                                     "total":  35,
                                     "healthDrain":  0,
                                     "blast":  0,
                                     "void":  0
                                 },
                      "heavyAttackDamage":  null,
                      "damagePerShot":  [
                                            29.75,
                                            1.75,
                                            3.4999988,
                                            0,
                                            0,
                                            0,
                                            0,
                                            0,
                                            0,
                                            0,
                                            0,
                                            0,
                                            0,
                                            0,
                                            0,
                                            0,
                                            0,
                                            0,
                                            0,
                                            0
                                        ],
                      "range":  null,
                      "heavySlamRadialDamage":  null,
                      "sentinel":  true,
                      "comboDuration":  null,
                      "stancePolarity":  null,
                      "slideAttack":  null,
                      "windUp":  null,
                      "followThrough":  null,
                      "slamAttack":  null,
                      "heavySlamRadius":  null,
                      "heavySlamAttack":  null
                  },
    "aliases":  [
                    "/Lotus/Types/Sentinels/SentinelWeapons/SentShotgun"
                ],
    "tags":  [
                 "weapon",
                 "companion"
             ],
    "category":  "weapon",
    "relationships":  [

                      ],
    "description":  "Standard issue weapon for Carrier Sentinel. Fires shotgun rounds.",
    "release":  {
                    "releaseDate":  "2013-09-13",
                    "introduced":  {
                                       "date":  "2013-09-13",
                                       "parent":  "10.0",
                                       "url":  "https://wiki.warframe.com/w/Update_10%23Update_10.0",
                                       "name":  "Update 10.0",
                                       "aliases":  [
                                                       "Update 10",
                                                       "10",
                                                       "10.0"
                                                   ]
                                   }
                },
    "summary":  "Standard issue weapon for Carrier Sentinel. Fires shotgun rounds.",
    "stats":  {
                  "accuracy":  3.3333333,
                  "noise":  "Alarming",
                  "polarities":  [
                                     "madurai",
                                     "madurai"
                                 ],
                  "tradable":  false,
                  "disposition":  4,
                  "fireRate":  1,
                  "critMultiplier":  1.75,
                  "totalDamage":  35,
                  "vaulted":  null,
                  "masteryReq":  0,
                  "reloadTime":  2.3,
                  "estimatedVaultDate":  null,
                  "trigger":  "Auto",
                  "critChance":  0.1,
                  "magazineSize":  10,
                  "masterable":  true,
                  "slot":  "companion",
                  "weaponClass":  "Companion Weapon",
                  "statusChance":  0.045000017,
                  "vaultDate":  null,
                  "multishot":  6
              }
}
