{
    "id":  "relic.meso-g7-exceptional",
    "sources":  [
                    {
                        "type":  "static-import",
                        "value":  "imports/static/source-snapshots/wfcd/wfcd-relics.json"
                    }
                ],
    "name":  "Meso G7 Exceptional",
    "subCategory":  "meso",
    "notes":  [
                  "Normalized from static import source.",
                  "Converted from WFCD Relics.json."
              ],
    "mechanics":  {
                      "wiki":  {
                                   "thumbnail":  null,
                                   "url":  null,
                                   "imageName":  "RelicMesoA.png",
                                   "available":  null
                               },
                      "era":  "Meso",
                      "rewards":  [

                                  ],
                      "drops":  [
                                    null
                                ]
                  },
    "aliases":  [
                    "/Lotus/Types/Game/Projections/T2VoidProjectionProteaPrimeBSilver"
                ],
    "tags":  [
                 "relic",
                 "meso"
             ],
    "category":  "relic",
    "relationships":  [

                      ],
    "description":  "An artifact containing Orokin secrets. It can only be opened through the power of the Void.",
    "release":  {
                    "releaseDate":  null,
                    "introduced":  null
                },
    "summary":  "An artifact containing Orokin secrets. It can only be opened through the power of the Void.",
    "stats":  {
                  "tradable":  true,
                  "vaulted":  true,
                  "masterable":  false
              }
}
