{
    "id":  "part.harrow-neuroptics",
    "name":  "Neuroptics",
    "category":  "item_part",
    "subCategory":  "component",
    "aliases":  [

                ],
    "summary":  "Neuroptics component of the Harrow Warframe.",
    "description":  "Neuroptics component of the Harrow Warframe.",
    "stats":  {

              },
    "mechanics":  {

                  },
    "relationships":  [
                          "warframe.harrow"
                      ],
    "release":  {

                },
    "tags":  [
                 "part",
                 "wfcd-generated"
             ],
    "notes":  [
                  "Generated from WFCD component or relic reward data."
              ],
    "sources":  [
                    {
                        "type":  "wfcd-generated",
                        "value":  "component:warframe.harrow"
                    }
                ]
}
