{
    "id":  "part.nyx-blueprint",
    "name":  "Blueprint",
    "category":  "item_part",
    "subCategory":  "component",
    "aliases":  [

                ],
    "summary":  "Psychic attacks make Nyx a dangerous foe. She reaches into enemy consciousness to provide crowd control and turn their attacks back on them. Such manipulation can turn the tide of battle.",
    "description":  "Psychic attacks make Nyx a dangerous foe. She reaches into enemy consciousness to provide crowd control and turn their attacks back on them. Such manipulation can turn the tide of battle.",
    "stats":  {

              },
    "mechanics":  {

                  },
    "relationships":  [
                          "warframe.nyx"
                      ],
    "release":  {

                },
    "tags":  [
                 "part",
                 "wfcd-generated"
             ],
    "notes":  [
                  "Generated from WFCD component or relic reward data."
              ],
    "sources":  [
                    {
                        "type":  "wfcd-generated",
                        "value":  "component:warframe.nyx"
                    }
                ]
}
