{
    "id":  "part.dera-vandal-stock",
    "name":  "Stock",
    "category":  "item_part",
    "subCategory":  "component",
    "aliases":  [

                ],
    "summary":  "A weapon-crafting component.",
    "description":  "A weapon-crafting component.",
    "stats":  {

              },
    "mechanics":  {

                  },
    "relationships":  [
                          "weapon.dera-vandal"
                      ],
    "release":  {

                },
    "tags":  [
                 "part",
                 "wfcd-generated"
             ],
    "notes":  [
                  "Generated from WFCD component or relic reward data."
              ],
    "sources":  [
                    {
                        "type":  "wfcd-generated",
                        "value":  "component:weapon.dera-vandal"
                    }
                ]
}
