{
    "id":  "part.kestrel-prime-blueprint",
    "name":  "Blueprint",
    "category":  "item_part",
    "subCategory":  "component",
    "aliases":  [

                ],
    "summary":  "With heightened agility and power the Kestrel Prime’s heavy attacks easily knock down foes, ensuring none shall stand before it.",
    "description":  "With heightened agility and power the Kestrel Prime’s heavy attacks easily knock down foes, ensuring none shall stand before it.",
    "stats":  {

              },
    "mechanics":  {

                  },
    "relationships":  [
                          "weapon.kestrel-prime"
                      ],
    "release":  {

                },
    "tags":  [
                 "part",
                 "wfcd-generated"
             ],
    "notes":  [
                  "Generated from WFCD component or relic reward data."
              ],
    "sources":  [
                    {
                        "type":  "wfcd-generated",
                        "value":  "component:weapon.kestrel-prime"
                    }
                ]
}
