{
    "id":  "mod.jade-s-judgment",
    "sources":  [
                    {
                        "type":  "static-import",
                        "value":  "imports/static/source-snapshots/wfcd/wfcd-mods.json"
                    }
                ],
    "name":  "Jade\u0027s Judgment",
    "subCategory":  "jade",
    "notes":  [
                  "Normalized from static import source.",
                  "Converted from WFCD Mods.json."
              ],
    "mechanics":  {
                      "topRankStats":  [
                                           "Light\u0027s Judgment Augment: Enemies damaged by the well have a 5% chance per hit to spawn a Jade Light above them, damaging them for 3s."
                                       ],
                      "type":  "Warframe Mod",
                      "drops":  [
                                    {
                                        "location":  "Arbiters of Hexis, Maxim",
                                        "type":  "Jade\u0027s Judgment (Jade)",
                                        "chance":  100,
                                        "rarity":  "Common"
                                    },
                                    {
                                        "location":  "Red Veil, Exalted",
                                        "type":  "Jade\u0027s Judgment (Jade)",
                                        "chance":  100,
                                        "rarity":  "Common"
                                    }
                                ],
                      "isAugment":  true,
                      "levelStats":  [
                                         "Light\u0027s Judgment Augment: Enemies damaged by the well have a 2% chance per hit to spawn a Jade Light above them, damaging them for 1.5s.",
                                         "Light\u0027s Judgment Augment: Enemies damaged by the well have a 3% chance per hit to spawn a Jade Light above them, damaging them for 2s.",
                                         "Light\u0027s Judgment Augment: Enemies damaged by the well have a 4% chance per hit to spawn a Jade Light above them, damaging them for 2.5s.",
                                         "Light\u0027s Judgment Augment: Enemies damaged by the well have a 5% chance per hit to spawn a Jade Light above them, damaging them for 3s."
                                     ],
                      "wiki":  {
                                   "thumbnail":  "https://wiki.warframe.com/images/Jade%27sJudgmentMod.png?bc6e9",
                                   "url":  "https://wiki.warframe.com/w/Jade\u0027s_Judgment",
                                   "imageName":  "ChoirPoolAugmentCard.jpg",
                                   "available":  true
                               }
                  },
    "aliases":  [
                    "/Lotus/Powersuits/Choir/ChoirPoolAugmentCard"
                ],
    "tags":  [
                 "mod"
             ],
    "category":  "mod",
    "relationships":  [

                      ],
    "description":  "Light\u0027s Judgment Augment: Enemies damaged by the well have a 5% chance per hit to spawn a Jade Light above them, damaging them for 3s.",
    "release":  {
                    "releaseDate":  "2025-06-25",
                    "introduced":  {
                                       "date":  "2025-06-25",
                                       "parent":  "39.0",
                                       "url":  "https://wiki.warframe.com/w/Update_39%23Update_39.0",
                                       "name":  "Update 39.0",
                                       "aliases":  [
                                                       "39",
                                                       "39.0",
                                                       "Isleweaver"
                                                   ]
                                   }
                },
    "summary":  "Light\u0027s Judgment Augment: Enemies damaged by the well have a 5% chance per hit to spawn a Jade Light above them, damaging them for 3s.",
    "stats":  {
                  "baseDrain":  6,
                  "tradable":  true,
                  "compatName":  "Jade",
                  "masterable":  false,
                  "polarity":  "zenurik",
                  "fusionLimit":  3,
                  "isPrime":  false,
                  "rarity":  "Rare",
                  "transmutable":  false
              }
}
