{
    "id":  "part.talons-ferrite",
    "name":  "Ferrite",
    "category":  "item_part",
    "subCategory":  "component",
    "aliases":  [

                ],
    "summary":  "Alloy pellets used in Grineer manufacturing.\n\nLocation: Mercury, Earth, Lua, Neptune, and the Void",
    "description":  "Alloy pellets used in Grineer manufacturing.\n\nLocation: Mercury, Earth, Lua, Neptune, and the Void",
    "stats":  {

              },
    "mechanics":  {

                  },
    "relationships":  [
                          "weapon.talons"
                      ],
    "release":  {

                },
    "tags":  [
                 "part",
                 "wfcd-generated"
             ],
    "notes":  [
                  "Generated from WFCD component or relic reward data."
              ],
    "sources":  [
                    {
                        "type":  "wfcd-generated",
                        "value":  "component:weapon.talons"
                    }
                ]
}
