{
    "id":  "relic.axi-g15-intact",
    "sources":  [
                    {
                        "type":  "static-import",
                        "value":  "imports/static/source-snapshots/wfcd/wfcd-relics.json"
                    }
                ],
    "name":  "Axi G15 Intact",
    "subCategory":  "axi",
    "notes":  [
                  "Normalized from static import source.",
                  "Converted from WFCD Relics.json."
              ],
    "mechanics":  {
                      "wiki":  {
                                   "thumbnail":  null,
                                   "url":  null,
                                   "imageName":  "RelicAxiD.png",
                                   "available":  null
                               },
                      "era":  "Axi",
                      "rewards":  [

                                  ],
                      "drops":  [
                                    null
                                ]
                  },
    "aliases":  [
                    "/Lotus/Types/Game/Projections/T4VoidProjectionGaussGrendelVaultABronze"
                ],
    "tags":  [
                 "relic",
                 "axi"
             ],
    "category":  "relic",
    "relationships":  [

                      ],
    "description":  "An artifact containing Orokin secrets. It can only be opened through the power of the Void.",
    "release":  {
                    "releaseDate":  null,
                    "introduced":  null
                },
    "summary":  "An artifact containing Orokin secrets. It can only be opened through the power of the Void.",
    "stats":  {
                  "tradable":  true,
                  "vaulted":  true,
                  "masterable":  false
              }
}
