{
    "id":  "gear.kahl-beacon",
    "sources":  [
                    {
                        "type":  "static-import",
                        "value":  "imports/static/source-snapshots/wfcd/wfcd-gear.json"
                    }
                ],
    "name":  "Kahl Beacon",
    "subCategory":  "gear",
    "notes":  [
                  "Normalized from static import source.",
                  "Converted from WFCD Gear.json."
              ],
    "mechanics":  {
                      "wiki":  {
                                   "thumbnail":  null,
                                   "url":  null,
                                   "imageName":  "kahl-beacon-6497e71f81.png",
                                   "available":  null
                               },
                      "drops":  [
                                    null
                                ],
                      "crafting":  {
                                       "buildTime":  null,
                                       "buildPrice":  null,
                                       "buildQuantity":  null,
                                       "components":  [
                                                          {
                                                              "name":  null,
                                                              "uniqueName":  null,
                                                              "itemCount":  null,
                                                              "type":  null,
                                                              "tradable":  null,
                                                              "drops":  [
                                                                            null
                                                                        ]
                                                          }
                                                      ],
                                       "skipBuildTimePrice":  null,
                                       "consumeOnBuild":  null
                                   }
                  },
    "aliases":  [
                    "/Lotus/Types/Restoratives/LisetKahl"
                ],
    "tags":  [
                 "gear",
                 "gear"
             ],
    "category":  "gear",
    "relationships":  [

                      ],
    "description":  "Calls Kahl and a retinue of his Brothers to assist you for a limited time. Subsequent uses heal Kahl\u0027s squad and add an additional Brother.",
    "release":  {

                },
    "summary":  "Calls Kahl and a retinue of his Brothers to assist you for a limited time. Subsequent uses heal Kahl\u0027s squad and add an additional Brother.",
    "stats":  {
                  "tradable":  false,
                  "type":  "Gear",
                  "masterable":  false
              }
}
