{
    "id":  "part.magnus-alloy-plate",
    "name":  "Alloy Plate",
    "category":  "item_part",
    "subCategory":  "component",
    "aliases":  [

                ],
    "summary":  "Carbon steel plates used to reinforce Grineer armor.\n\nLocation: Venus, Phobos, Ceres, Jupiter, Pluto, and Sedna.",
    "description":  "Carbon steel plates used to reinforce Grineer armor.\n\nLocation: Venus, Phobos, Ceres, Jupiter, Pluto, and Sedna.",
    "stats":  {

              },
    "mechanics":  {

                  },
    "relationships":  [
                          "weapon.magnus"
                      ],
    "release":  {

                },
    "tags":  [
                 "part",
                 "wfcd-generated"
             ],
    "notes":  [
                  "Generated from WFCD component or relic reward data."
              ],
    "sources":  [
                    {
                        "type":  "wfcd-generated",
                        "value":  "component:weapon.magnus"
                    }
                ]
}
