{
    "id":  "mod.magnetic-claws",
    "sources":  [
                    {
                        "type":  "static-import",
                        "value":  "imports/static/source-snapshots/wfcd/wfcd-mods.json"
                    }
                ],
    "name":  "Magnetic Claws",
    "subCategory":  "claws",
    "notes":  [
                  "Normalized from static import source.",
                  "Converted from WFCD Mods.json."
              ],
    "mechanics":  {
                      "topRankStats":  [
                                           "+60% \u003cDT_MAGNETIC_COLOR\u003eMagnetic",
                                           "+40% Status Duration"
                                       ],
                      "type":  "Companion Mod",
                      "drops":  [
                                    {
                                        "location":  "Techrot Volatile Galliflex",
                                        "type":  "Magnetic Claws",
                                        "chance":  0.08,
                                        "rarity":  "Rare"
                                    },
                                    {
                                        "location":  "Techrot Galliflex",
                                        "type":  "Magnetic Claws",
                                        "chance":  0.13,
                                        "rarity":  "Rare"
                                    }
                                ],
                      "isAugment":  null,
                      "levelStats":  [
                                         "+15% \u003cDT_MAGNETIC_COLOR\u003eMagnetic",
                                         "+10% Status Duration",
                                         "+30% \u003cDT_MAGNETIC_COLOR\u003eMagnetic",
                                         "+20% Status Duration",
                                         "+45% \u003cDT_MAGNETIC_COLOR\u003eMagnetic",
                                         "+30% Status Duration",
                                         "+60% \u003cDT_MAGNETIC_COLOR\u003eMagnetic",
                                         "+40% Status Duration"
                                     ],
                      "wiki":  {
                                   "thumbnail":  "https://wiki.warframe.com/images/MagneticClawsMod.png?389b9",
                                   "url":  "https://wiki.warframe.com/w/Magnetic_Claws",
                                   "imageName":  "KubrowMagneticEventMeleeMod.jpg",
                                   "available":  true
                               }
                  },
    "aliases":  [
                    "/Lotus/Upgrades/Mods/Sentinel/Kubrow/DualStat/KubrowMagneticEventMeleeMod"
                ],
    "tags":  [
                 "mod"
             ],
    "category":  "mod",
    "relationships":  [

                      ],
    "description":  "+60% \u003cDT_MAGNETIC_COLOR\u003eMagnetic +40% Status Duration",
    "release":  {
                    "releaseDate":  "2024-12-13",
                    "introduced":  {
                                       "date":  "2024-12-13",
                                       "parent":  "38.0",
                                       "url":  "https://wiki.warframe.com/w/Update_38%23Update_38.0",
                                       "name":  "Update 38.0",
                                       "aliases":  [
                                                       "38",
                                                       "38.0",
                                                       "Warframe: 1999"
                                                   ]
                                   }
                },
    "summary":  "+60% \u003cDT_MAGNETIC_COLOR\u003eMagnetic +40% Status Duration",
    "stats":  {
                  "baseDrain":  4,
                  "tradable":  true,
                  "compatName":  "Claws",
                  "masterable":  false,
                  "polarity":  "madurai",
                  "fusionLimit":  3,
                  "isPrime":  false,
                  "rarity":  "Rare",
                  "transmutable":  false
              }
}
