{
    "id":  "mod.archon-intensify",
    "sources":  [
                    {
                        "type":  "static-import",
                        "value":  "imports/static/source-snapshots/wfcd/wfcd-mods.json"
                    }
                ],
    "name":  "Archon Intensify",
    "subCategory":  "warframe",
    "notes":  [
                  "Normalized from static import source.",
                  "Converted from WFCD Mods.json."
              ],
    "mechanics":  {
                      "topRankStats":  [
                                           "+30% Ability Strength",
                                           "Restoring health with abilities grants +30% Ability Strength for 10s."
                                       ],
                      "type":  "Warframe Mod",
                      "drops":  [
                                    null
                                ],
                      "isAugment":  true,
                      "levelStats":  [
                                         "+2.7% Ability Strength",
                                         "Restoring health with abilities grants +30% Ability Strength for 10s.",
                                         "+5.5% Ability Strength",
                                         "Restoring health with abilities grants +30% Ability Strength for 10s.",
                                         "+8.2% Ability Strength",
                                         "Restoring health with abilities grants +30% Ability Strength for 10s.",
                                         "+10.9% Ability Strength",
                                         "Restoring health with abilities grants +30% Ability Strength for 10s.",
                                         "+13.6% Ability Strength",
                                         "Restoring health with abilities grants +30% Ability Strength for 10s.",
                                         "+16.4% Ability Strength",
                                         "Restoring health with abilities grants +30% Ability Strength for 10s.",
                                         "+19.1% Ability Strength",
                                         "Restoring health with abilities grants +30% Ability Strength for 10s.",
                                         "+21.8% Ability Strength",
                                         "Restoring health with abilities grants +30% Ability Strength for 10s.",
                                         "+24.5% Ability Strength",
                                         "Restoring health with abilities grants +30% Ability Strength for 10s.",
                                         "+27.3% Ability Strength",
                                         "Restoring health with abilities grants +30% Ability Strength for 10s.",
                                         "+30% Ability Strength",
                                         "Restoring health with abilities grants +30% Ability Strength for 10s."
                                     ],
                      "wiki":  {
                                   "thumbnail":  "https://wiki.warframe.com/images/ArchonIntensifyMod.png?582da",
                                   "url":  "https://wiki.warframe.com/w/Archon_Intensify",
                                   "imageName":  "KahlAvatarAbilityStrengthMod.jpg",
                                   "available":  true
                               }
                  },
    "aliases":  [
                    "/Lotus/Upgrades/Mods/Warframe/Kahl/KahlAvatarAbilityStrengthMod"
                ],
    "tags":  [
                 "mod"
             ],
    "category":  "mod",
    "relationships":  [

                      ],
    "description":  "+30% Ability Strength Restoring health with abilities grants +30% Ability Strength for 10s.",
    "release":  {
                    "releaseDate":  "2022-09-08",
                    "introduced":  {
                                       "date":  "2022-09-08",
                                       "parent":  "32.0",
                                       "url":  "https://wiki.warframe.com/w/Update_32%23Hotfix_32.0.2",
                                       "name":  "Hotfix 32.0.2",
                                       "aliases":  [
                                                       "32.0.2"
                                                   ]
                                   }
                },
    "summary":  "+30% Ability Strength Restoring health with abilities grants +30% Ability Strength for 10s.",
    "stats":  {
                  "baseDrain":  6,
                  "tradable":  true,
                  "compatName":  "WARFRAME",
                  "masterable":  false,
                  "polarity":  "madurai",
                  "fusionLimit":  10,
                  "isPrime":  false,
                  "rarity":  "Legendary",
                  "transmutable":  false
              }
}
