{
    "id":  "part.ankyros-nano-spores",
    "name":  "Nano Spores",
    "category":  "item_part",
    "subCategory":  "component",
    "aliases":  [

                ],
    "summary":  "Fibrous technocyte tumour. Handle Infested tissue with caution.\n\nLocation: Saturn, Neptune, Eris, and Deimos",
    "description":  "Fibrous technocyte tumour. Handle Infested tissue with caution.\n\nLocation: Saturn, Neptune, Eris, and Deimos",
    "stats":  {

              },
    "mechanics":  {

                  },
    "relationships":  [
                          "weapon.ankyros"
                      ],
    "release":  {

                },
    "tags":  [
                 "part",
                 "wfcd-generated"
             ],
    "notes":  [
                  "Generated from WFCD component or relic reward data."
              ],
    "sources":  [
                    {
                        "type":  "wfcd-generated",
                        "value":  "component:weapon.ankyros"
                    }
                ]
}
